{
  "standardVersion": "1.1.0",
  "projectVersion": "3.0.1",
  "project": "anki-pipeline",
  "owner": "CHNragdoll (repository owner and local data owner; approval decisions by the user)",
  "purpose": "Owner-controlled local vocabulary, dictionary and exam-source integration into Anki packages and complete web previews; excludes unattended ingestion, hosted service use, or automatic changes to the owner Anki collection.",
  "distributionModel": "Public GitHub source with MIT for original code. The owner authorizes formal v3.0.1 publication on 2026-10-04, subject to separate PR-specific merge consent. The v3.0.1 Release has one verified APKG. Separately authorized redbook-2026.10.06 and redbook-2027.10.06 book releases provide APKG and verification attachments; source Markdown and screenshots remain in Git. Each source merge requires PR-specific owner consent. Third-party learning resources and dependency licenses remain separate. The owner additionally authorizes the 2026-10-15 complete Red Book releases redbook-2026.10.15 and redbook-2027.10.15. Original tags/assets remain immutable; the new packages and summaries are separate release attachments.",
  "repository": {
    "system": "Git and public GitHub",
    "location": "https://github.com/CHNragdoll/anki-pipeline",
    "defaultBranch": "main",
    "reviewMechanism": "GitHub main protection requires a PR, strict current-base checks test (3.11) and test (3.13) from GitHub Actions app 15368, resolved conversations, administrator enforcement and no force pushes or deletion. GitHub approving review count is 0: the owner explicitly chose PR-specific consent in this conversation. AGENTS.md requires the human owner to explicitly approve EACH PR before Codex merges it; CI, agent review, authorship and general release authorization do not substitute for consent. Recheck live rules and current diff before merging. See docs/BRANCH_PROTECTION.md."
  },
  "reviewClassification": {
    "changeTypes": {
      "bug": "type:bug",
      "feature": "type:feature",
      "docs": "type:docs",
      "refactor": "type:refactor",
      "maintenance": "type:maintenance",
      "security": "type:security"
    },
    "riskLevels": {
      "R1": "risk:R1",
      "R2": "risk:R2",
      "R3": "risk:R3",
      "R4": "risk:R4"
    },
    "flags": {
      "breaking-change": "breaking-change",
      "dependencies": "dependencies",
      "migration": "migration",
      "needs-manual-test": "needs-manual-test",
      "blocked": "blocked"
    }
  },
  "environments": [
    "Development and verification: owner-controlled macOS, uv-locked Python plus project-local locked Node tests.",
    "Local trial: read-only prepared study inputs, derived in-memory exam examples, APKG and complete web preview output.",
    "Anki 26.9.3 backend temporary-collection import and isolated Qt reviewer rendering are recorded separately from browser checks; no import into the owner profile.",
    "Huawei OCE-AN10, Android API 31, AnkiDroid 2.20.1 physical-device import/reviewer checks for v3.0.1 are recorded in docs/RELEASE_3_0_1.md. iPhone recovery is owner-reported; no new physical AnkiMobile acceptance run is claimed.",
    "2026-10-15 Red Book packages: native Anki temporary-collection update and repeat import passed for both books. The owner confirmed only abide/venture two-card AnkiMobile Browse -> Search -> Preview disclosures; do not generalize this to an exhaustive phone sweep."
  ],
  "platforms": [
    "Python >=3.11 declared in metadata; CI and locally observed runtimes are verified only within their recorded scopes.",
    "Node ^20.19.0 || ^22.13.0 || >=24.0.0 for JavaScript verification, with CI using Node 24.",
    "Owner macOS, Anki backend and Qt reviewer snapshots; browser responsive layout does not prove physical Anki mobile-device acceptance."
  ],
  "architecture": "Local CLI -> read-only legacy/Excel/PDF/dictionary/etymology/exam indexes and approved sidecars -> exact word forms, source identities and original-position frequency -> validated derived display -> genanki APKG, complete HTML catalog and optional portable web ZIP. The paired exam-library validates deep links and frames original context. Original source and derived display coordinates remain separate.",
  "stateModel": "Original inputs remain read-only. New SQLite schema v1 is authoritative for migrated/edited cards, raw records, translations and events. Exam and dictionary enrichment used during export is derived in memory; approved JSON sidecars bind identities and review hashes. Media, backup, CSV, APKG and web snapshots have separate roles. Restore only to a new path.",
  "dataClassification": [
    "Private owner study data: workbook words/definitions, exam sentence text, manual translations, local audio and raw legacy rows.",
    "Sensitive operational material: local paths, migration reports, content hashes, backup and export files.",
    "Explicit CLI enrichment requests transmit headwords to dictionary HTTPS providers. Current card sentence icons jump to configured exam-source URLs; no online sentence TTS entry remains. Raw SQLite and audio libraries are not uploaded to providers. The separately authorized public Release APKGs embed study text and audio and are excluded from Git source history; small publication reports and checksum files are separate attachments."
  ],
  "trustBoundaries": [
    "Local owner OS account and CLI/config/filesystem; no application login, remote service endpoint or session.",
    "Read-only legacy SQLite/workbook/PDF/audio to separately owned new state.",
    "Untrusted CSV and external dictionary HTTPS to validated local SQLite/audio.",
    "Public GitHub source and explicitly owner-authorized APKG Release boundary; raw local inputs, credentials, databases, backups and other generated artifacts remain excluded from source history."
  ],
  "riskLevel": "R2",
  "riskRationale": "Migration and translation misalignment can lose or misrepresent recoverable personal study content; generated packages can mislead learning. No public service, payment, privilege escalation, safety or regulated workflow is in scope. Backup and isolated restore reduce but do not eliminate impact.",
  "selectedProfiles": [],
  "applicability": [
    {
      "controlId": "GOV-001",
      "status": "applicable",
      "rationale": "The private repository and local data need one owner to decide scope, release, recovery, and retirement.",
      "evidence": [
        {
          "kind": "applicability basis",
          "location": "docs/PROJECT_PROFILE.md",
          "subject": "3.0.0-rc.1 candidate scope",
          "current": true
        }
      ]
    },
    {
      "controlId": "GOV-002",
      "status": "applicable",
      "rationale": "The local vocabulary-to-Anki trial has a specific owner consumer and excludes automatic Anki collection import.",
      "evidence": [
        {
          "kind": "applicability basis",
          "location": "docs/PROJECT_PROFILE.md",
          "subject": "3.0.0-rc.1 candidate scope",
          "current": true
        }
      ]
    },
    {
      "controlId": "GOV-003",
      "status": "applicable",
      "rationale": "The owner must retain private source, old inputs, new SQLite state, audio, lockfile, and restoration knowledge.",
      "evidence": [
        {
          "kind": "applicability basis",
          "location": "docs/PROJECT_PROFILE.md",
          "subject": "3.0.0-rc.1 candidate scope",
          "current": true
        }
      ]
    },
    {
      "controlId": "GOV-004",
      "status": "applicable",
      "rationale": "Migration and package errors can corrupt a recoverable study workflow, so project impact is classified R2.",
      "evidence": [
        {
          "kind": "applicability basis",
          "location": "docs/PROJECT_PROFILE.md",
          "subject": "3.0.0-rc.1 candidate scope",
          "current": true
        }
      ]
    },
    {
      "controlId": "GOV-005",
      "status": "applicable",
      "rationale": "First adoption requires all 92 catalog controls to be considered against this CLI, state, and release model.",
      "evidence": [
        {
          "kind": "applicability basis",
          "location": "docs/project-standard/control-catalog.json",
          "subject": "3.0.0-rc.1 candidate scope",
          "current": true
        }
      ]
    },
    {
      "controlId": "GOV-006",
      "status": "applicable",
      "rationale": "The owner authorized implementation and private prerelease; merge and production decisions still need recorded authority.",
      "evidence": [
        {
          "kind": "applicability basis",
          "location": "PLAN.md",
          "subject": "3.0.0-rc.1 candidate scope",
          "current": true
        }
      ]
    },
    {
      "controlId": "GOV-007",
      "status": "applicable",
      "rationale": "Any future deviation from a mandatory gate needs scoped, expiring owner approval rather than a silent bypass.",
      "evidence": [
        {
          "kind": "applicability basis",
          "location": "docs/PROJECT_PROFILE.md",
          "subject": "3.0.0-rc.1 candidate scope",
          "current": true
        }
      ]
    },
    {
      "controlId": "REQ-001",
      "status": "applicable",
      "rationale": "The rebuild addresses legacy prefix false matches, duplicate merging, fragile translation alignment, and recovery risk.",
      "evidence": [
        {
          "kind": "applicability basis",
          "location": "PLAN.md",
          "subject": "3.0.0-rc.1 candidate scope",
          "current": true
        }
      ]
    },
    {
      "controlId": "REQ-002",
      "status": "applicable",
      "rationale": "The change boundaries include a new local pipeline, migrated state, and prerelease while keeping V2.0 inputs read-only.",
      "evidence": [
        {
          "kind": "applicability basis",
          "location": "PLAN.md",
          "subject": "3.0.0-rc.1 candidate scope",